{
  "$id": "overlay-descriptor.json",
  "$schema": "https://json-schema.org/draft/2020-12/schema",
  "title": "sswg overlay descriptor",
  "type": "object",
  "additionalProperties": false,
  "required": [
    "base_schema_ref",
    "overlay_id",
    "overlay_version",
    "operations",
    "precedence",
    "compatibility"
  ],
  "properties": {
    "base_schema_ref": { "type": "string" },
    "overlay_id": { "type": "string" },
    "overlay_version": { "type": "string" },
    "operations": {
      "type": "array",
      "minItems": 1,
      "items": {
        "type": "object",
        "additionalProperties": false,
        "required": ["op", "path"],
        "properties": {
          "op": {
            "type": "string",
            "enum": ["add", "override", "deprecate"]
          },
          "path": { "type": "string" },
          "value": {}
        }
      }
    },
    "precedence": {
      "type": "object",
      "additionalProperties": false,
      "required": ["scope", "rules"],
      "properties": {
        "scope": { "type": "string", "minLength": 1 },
        "rules": { "type": "string", "minLength": 1 },
        "order": { "type": "integer", "minimum": 0 },
        "notes": { "type": "string" }
      }
    },
    "compatibility": {
      "$ref": "compatibility-contract.json#"
    }
  }
}
