{
  "base_schema_ref": "schemas/pdl.json#",
  "overlay_id": "example_overlay",
  "overlay_version": "1.0.0",
  "operations": [
    {
      "op": "override",
      "path": "/phases/3/constraints/deterministic_required",
      "value": true
    }
  ],
  "precedence": {
    "scope": "pdl",
    "rules": "Explicit overlay precedence for PDL phase constraints.",
    "order": 10,
    "notes": "Overlay applies only to PDL phase constraints. Explicit ordering."
  },
  "compatibility": {
    "compatibility": "backward",
    "supported_base_versions": ["1.0.0"]
  }
}
